{"schema_version":"pod-view.v1","load_input_sha256":"4788692d18ac4be6f384d16883e14fd898bbfdc401da2a712c3c9d00a51fc2ed","resource_snapshot_sha256":"e3b008e14e618caae5a99390be5ae4b38da77a4c9fc4028b7e43ed2d442f0b01","arm":"B","start_epoch_ms":1704067200000,"step_ms":10000,"column_count":6,"coverage":{"pods_observed_total":5,"pods_included":5,"rows_observed_total":35,"rows_included":35,"selection":{"kind":"ALL"}},"pods":[{"pod":"svc-01-b1","service":"svc-01","containers":[{"name":"app","role":"app"},{"name":"istio-proxy","role":"sidecar"}]},{"pod":"svc-01-b2","service":"svc-01","containers":[{"name":"app","role":"app"},{"name":"istio-proxy","role":"sidecar"}]},{"pod":"svc-01-b3","service":"svc-01","containers":[{"name":"app","role":"app"},{"name":"istio-proxy","role":"sidecar"}]},{"pod":"svc-02-b1","service":"svc-02","containers":[{"name":"app","role":"app"},{"name":"istio-proxy","role":"sidecar"}]},{"pod":"svc-02-b2","service":"svc-02","containers":[{"name":"app","role":"app"},{"name":"istio-proxy","role":"sidecar"}]}],"rows":[{"id":"r00001","pod":"svc-01-b1","container":null,"metric":"openshift_pod_cpu_usage","unit":"cores","aggregation":"interval_mean","values":[0.522,0.52,0.5245,0.53,0.5275,0.5205]},{"id":"r00002","pod":"svc-01-b1","container":"app","metric":"openshift_container_cpu_limit_ratio","unit":"ratio","aggregation":"interval_mean","values":[0.3985,0.4105,0.3985,0.4005,0.4075,0.406]},{"id":"r00003","pod":"svc-01-b1","container":"app","metric":"openshift_container_memory_limit_ratio","unit":"ratio","aggregation":"interval_mean","values":[0.4545,0.4545,0.46,0.459,0.4495,0.447]},{"id":"r00004","pod":"svc-01-b1","container":"app","metric":"openshift_cpu_throttling","unit":"ratio","aggregation":"interval_mean","values":[0.0425,0.041,0.0485,0.04,0.0495,0.035]},{"id":"r00005","pod":"svc-01-b1","container":"istio-proxy","metric":"openshift_container_cpu_limit_ratio","unit":"ratio","aggregation":"interval_mean","values":[0.1545,0.153,0.151,0.1545,0.15,0.1555]},{"id":"r00006","pod":"svc-01-b1","container":"istio-proxy","metric":"openshift_container_memory_limit_ratio","unit":"ratio","aggregation":"interval_mean","values":[0.241,0.244,0.244,0.2375,0.2385,0.2385]},{"id":"r00007","pod":"svc-01-b1","container":"istio-proxy","metric":"openshift_cpu_throttling","unit":"ratio","aggregation":"interval_mean","values":[0.027,0.0235,0.018,0.0215,0.0215,0.016]},{"id":"r00008","pod":"svc-01-b2","container":null,"metric":"openshift_pod_cpu_usage","unit":"cores","aggregation":"interval_mean","values":[0.5245,0.5185,0.517,0.523,0.531,0.522]},{"id":"r00009","pod":"svc-01-b2","container":"app","metric":"openshift_container_cpu_limit_ratio","unit":"ratio","aggregation":"interval_mean","values":[0.414,0.412,0.409,0.4055,0.4135,0.405]},{"id":"r00010","pod":"svc-01-b2","container":"app","metric":"openshift_container_memory_limit_ratio","unit":"ratio","aggregation":"interval_mean","values":[0.508,0.595,0.693,0.7765,0.879,0.9645]},{"id":"r00011","pod":"svc-01-b2","container":"app","metric":"openshift_cpu_throttling","unit":"ratio","aggregation":"interval_mean","values":[0.0695,0.0625,0.072,0.066,0.074,0.0635]},{"id":"r00012","pod":"svc-01-b2","container":"istio-proxy","metric":"openshift_container_cpu_limit_ratio","unit":"ratio","aggregation":"interval_mean","values":[0.158,0.15,0.161,0.155,0.1595,0.153]},{"id":"r00013","pod":"svc-01-b2","container":"istio-proxy","metric":"openshift_container_memory_limit_ratio","unit":"ratio","aggregation":"interval_mean","values":[0.234,0.235,0.2285,0.223,0.2295,0.2235]},{"id":"r00014","pod":"svc-01-b2","container":"istio-proxy","metric":"openshift_cpu_throttling","unit":"ratio","aggregation":"interval_mean","values":[0.038,0.041,0.0385,0.043,0.038,0.0415]},{"id":"r00015","pod":"svc-01-b3","container":null,"metric":"openshift_pod_cpu_usage","unit":"cores","aggregation":"interval_mean","values":[0.525,0.523,0.5295,0.533,0.526,0.5215]},{"id":"r00016","pod":"svc-01-b3","container":"app","metric":"openshift_container_cpu_limit_ratio","unit":"ratio","aggregation":"interval_mean","values":[0.4155,0.4145,0.416,0.4245,0.428,0.416]},{"id":"r00017","pod":"svc-01-b3","container":"app","metric":"openshift_container_memory_limit_ratio","unit":"ratio","aggregation":"interval_mean","values":[0.49,0.495,0.4915,0.4845,0.493,0.4895]},{"id":"r00018","pod":"svc-01-b3","container":"app","metric":"openshift_cpu_throttling","unit":"ratio","aggregation":"interval_mean","values":[0.0495,0.0525,0.05,0.0525,0.0475,0.052]},{"id":"r00019","pod":"svc-01-b3","container":"istio-proxy","metric":"openshift_container_cpu_limit_ratio","unit":"ratio","aggregation":"interval_mean","values":[0.1565,0.162,0.1535,0.151,0.1615,0.1545]},{"id":"r00020","pod":"svc-01-b3","container":"istio-proxy","metric":"openshift_container_memory_limit_ratio","unit":"ratio","aggregation":"interval_mean","values":[0.2075,0.2045,0.2105,0.1985,0.2085,0.2035]},{"id":"r00021","pod":"svc-01-b3","container":"istio-proxy","metric":"openshift_cpu_throttling","unit":"ratio","aggregation":"interval_mean","values":[0.026,0.038,0.0325,0.0325,0.0345,0.03]},{"id":"r00022","pod":"svc-02-b1","container":null,"metric":"openshift_pod_cpu_usage","unit":"cores","aggregation":"interval_mean","values":[0.538,0.531,0.5325,0.533,0.5355,0.5285]},{"id":"r00023","pod":"svc-02-b1","container":"app","metric":"openshift_container_cpu_limit_ratio","unit":"ratio","aggregation":"interval_mean","values":[0.419,0.4185,0.427,0.4215,0.4295,0.4285]},{"id":"r00024","pod":"svc-02-b1","container":"app","metric":"openshift_container_memory_limit_ratio","unit":"ratio","aggregation":"interval_mean","values":[0.492,0.491,0.486,0.497,0.4915,0.496]},{"id":"r00025","pod":"svc-02-b1","container":"app","metric":"openshift_cpu_throttling","unit":"ratio","aggregation":"interval_mean","values":[0.0445,0.052,0.051,0.0525,0.052,0.0565]},{"id":"r00026","pod":"svc-02-b1","container":"istio-proxy","metric":"openshift_container_cpu_limit_ratio","unit":"ratio","aggregation":"interval_mean","values":[0.1625,0.1605,0.1625,0.151,0.1505,0.1645]},{"id":"r00027","pod":"svc-02-b1","container":"istio-proxy","metric":"openshift_container_memory_limit_ratio","unit":"ratio","aggregation":"interval_mean","values":[0.2225,0.2285,0.221,0.2285,0.231,0.2305]},{"id":"r00028","pod":"svc-02-b1","container":"istio-proxy","metric":"openshift_cpu_throttling","unit":"ratio","aggregation":"interval_mean","values":[0.0455,0.0475,0.055,0.0515,0.0435,0.0475]},{"id":"r00029","pod":"svc-02-b2","container":null,"metric":"openshift_pod_cpu_usage","unit":"cores","aggregation":"interval_mean","values":[0.544,0.535,0.5395,0.531,0.54,0.53]},{"id":"r00030","pod":"svc-02-b2","container":"app","metric":"openshift_container_cpu_limit_ratio","unit":"ratio","aggregation":"interval_mean","values":[0.407,0.418,0.411,0.417,0.413,0.4105]},{"id":"r00031","pod":"svc-02-b2","container":"app","metric":"openshift_container_memory_limit_ratio","unit":"ratio","aggregation":"interval_mean","values":[0.48,0.484,0.484,0.48,0.475,0.483]},{"id":"r00032","pod":"svc-02-b2","container":"app","metric":"openshift_cpu_throttling","unit":"ratio","aggregation":"interval_mean","values":[0.0705,0.0635,0.0715,0.07,0.068,0.0755]},{"id":"r00033","pod":"svc-02-b2","container":"istio-proxy","metric":"openshift_container_cpu_limit_ratio","unit":"ratio","aggregation":"interval_mean","values":[0.1665,0.165,0.161,0.157,0.16,0.1535]},{"id":"r00034","pod":"svc-02-b2","container":"istio-proxy","metric":"openshift_container_memory_limit_ratio","unit":"ratio","aggregation":"interval_mean","values":[0.226,0.234,0.229,0.224,0.236,0.2355]},{"id":"r00035","pod":"svc-02-b2","container":"istio-proxy","metric":"openshift_cpu_throttling","unit":"ratio","aggregation":"interval_mean","values":[0.028,0.0285,0.0345,0.0395,0.032,0.027]}]}
